    1 0.000000000    10.0.2.15 → 192.168.100.1 DNS 70 Standard query 0x5036 AAAA google.com
    2 0.000494138    10.0.2.15 → 192.168.100.1 DNS 70 Standard query 0xa328 A google.com
    3 0.025065606 192.168.100.1 → 10.0.2.15    DNS 98 Standard query response 0x5036 AAAA google.com AAAA 2a00:1450:4019:810::200e
    4 0.025066234 192.168.100.1 → 10.0.2.15    DNS 86 Standard query response 0xa328 A google.com A 142.250.202.142
    5 0.032541471    10.0.2.15 → 142.250.202.142 TCP 74 47002 → 443 [SYN] Seq=0 Win=64240 Len=0 MSS=1460 SACK_PERM TSval=3370998873 TSecr=0 WS=256
    6 0.183753235 142.250.202.142 → 10.0.2.15    TCP 60 443 → 47002 [SYN, ACK] Seq=0 Ack=1 Win=65535 Len=0 MSS=1460
    7 0.187799135    10.0.2.15 → 142.250.202.142 TCP 54 47002 → 443 [ACK] Seq=1 Ack=1 Win=64240 Len=0
    8 0.197585435    10.0.2.15 → 142.250.202.142 TLSv1.2 1748 Client Hello (SNI=google.com)
    9 0.200039637 142.250.202.142 → 10.0.2.15    TCP 60 443 → 47002 [ACK] Seq=1 Ack=1461 Win=65535 Len=0
   10 0.663531010    10.0.2.15 → 142.250.202.142 TCP 288 [TCP Retransmission] 47002 → 443 [PSH, ACK] Seq=1461 Ack=1 Win=64240 Len=234
   11 0.665413382 142.250.202.142 → 10.0.2.15    TCP 60 443 → 47002 [ACK] Seq=1 Ack=1695 Win=65535 Len=0
   12 0.869267750 142.250.202.142 → 10.0.2.15    TLSv1.3 1466 Server Hello, Change Cipher Spec
   13 0.869462054    10.0.2.15 → 142.250.202.142 TCP 54 47002 → 443 [ACK] Seq=1695 Ack=1413 Win=65535 Len=0
   14 0.873930410 142.250.202.142 → 10.0.2.15    TCP 1466 443 → 47002 [PSH, ACK] Seq=1413 Ack=1695 Win=65535 Len=1412
   15 0.873931001 142.250.202.142 → 10.0.2.15    TCP 1494 443 → 47002 [ACK] Seq=2825 Ack=1695 Win=65535 Len=1440
   16 0.873931072 142.250.202.142 → 10.0.2.15    TCP 1494 443 → 47002 [ACK] Seq=4265 Ack=1695 Win=65535 Len=1440
   17 0.874017362    10.0.2.15 → 142.250.202.142 TCP 54 47002 → 443 [ACK] Seq=1695 Ack=2825 Win=65535 Len=0
   18 0.874088688    10.0.2.15 → 142.250.202.142 TCP 54 47002 → 443 [ACK] Seq=1695 Ack=4265 Win=65535 Len=0
   19 0.874369334    10.0.2.15 → 142.250.202.142 TCP 54 47002 → 443 [ACK] Seq=1695 Ack=5705 Win=65535 Len=0
   20 0.875409872 142.250.202.142 → 10.0.2.15    TLSv1.3 607 Application Data
   21 0.875890141    10.0.2.15 → 142.250.202.142 TCP 54 47002 → 443 [ACK] Seq=1695 Ack=6258 Win=65535 Len=0
   22 0.914514505    10.0.2.15 → 142.250.202.142 TLSv1.3 134 Change Cipher Spec, Application Data
   23 0.915333243 142.250.202.142 → 10.0.2.15    TCP 60 443 → 47002 [ACK] Seq=6258 Ack=1775 Win=65535 Len=0
   24 0.916132185    10.0.2.15 → 142.250.202.142 TLSv1.3 176 Application Data
   25 0.916869544 142.250.202.142 → 10.0.2.15    TCP 60 443 → 47002 [ACK] Seq=6258 Ack=1897 Win=65535 Len=0
   26 0.916886718    10.0.2.15 → 142.250.202.142 TLSv1.3 102 Application Data
   27 0.917729569 142.250.202.142 → 10.0.2.15    TCP 60 443 → 47002 [ACK] Seq=6258 Ack=1945 Win=65535 Len=0
   28 0.972028290 142.250.202.142 → 10.0.2.15    TLSv1.3 735 Application Data, Application Data, Application Data
   29 0.973595301    10.0.2.15 → 142.250.202.142 TLSv1.3 85 Application Data
   30 0.977425418 142.250.202.142 → 10.0.2.15    TCP 60 443 → 47002 [ACK] Seq=6939 Ack=1976 Win=65535 Len=0
   31 1.437525761 142.250.202.142 → 10.0.2.15    TLSv1.3 474 Application Data
   32 1.441394213 142.250.202.142 → 10.0.2.15    TLSv1.3 305 Application Data
   33 1.441714352    10.0.2.15 → 142.250.202.142 TCP 54 47002 → 443 [ACK] Seq=1976 Ack=7610 Win=65535 Len=0
   34 1.442657543 142.250.202.142 → 10.0.2.15    TLSv1.3 124 Application Data, Application Data
   35 1.443462422    10.0.2.15 → 142.250.202.142 TLSv1.3 102 Application Data
   36 1.444370314    10.0.2.15 → 142.250.202.142 TLSv1.3 78 Application Data
   37 1.445039654 142.250.202.142 → 10.0.2.15    TCP 60 443 → 47002 [ACK] Seq=7680 Ack=2048 Win=65535 Len=0
   38 1.445442418    10.0.2.15 → 142.250.202.142 TCP 54 47002 → 443 [FIN, ACK] Seq=2048 Ack=7680 Win=65535 Len=0
   39 1.447542481 142.250.202.142 → 10.0.2.15    TCP 60 443 → 47002 [ACK] Seq=7680 Ack=2049 Win=65535 Len=0
   40 1.586386452 142.250.202.142 → 10.0.2.15    TCP 60 443 → 47002 [FIN, ACK] Seq=7680 Ack=2049 Win=65535 Len=0
   41 1.618970578    10.0.2.15 → 142.250.202.142 TCP 54 47002 → 443 [ACK] Seq=2049 Ack=7681 Win=19424 Len=0
   42 128.309035468    10.0.2.15 → 10.0.2.2     DHCP 324 DHCP Request  - Transaction ID 0x7dfa837b
   43 128.347306141 PCSSystemtec_34:73:29 → Broadcast    ARP 60 Who has 10.0.2.15? Tell 10.0.2.2
   44 128.347345101 PCSSystemtec_5a:87:bc → PCSSystemtec_34:73:29 ARP 42 10.0.2.15 is at 08:00:27:5a:87:bc
   45 128.347306701     10.0.2.2 → 10.0.2.15    DHCP 590 DHCP ACK      - Transaction ID 0x7dfa837b
   46 133.362894356 PCSSystemtec_5a:87:bc → PCSSystemtec_34:73:29 ARP 42 Who has 10.0.2.2? Tell 10.0.2.15
   47 133.365897221 PCSSystemtec_34:73:29 → PCSSystemtec_5a:87:bc ARP 60 10.0.2.2 is at 08:00:27:34:73:29
